{
  "schema_version": "1.0.0",
  "operation_id": "00000000-0000-4000-8000-000000000000",
  "from_role": "implementation",
  "to_role": "qa",
  "work_item": {
    "repository": "OWNER/REPOSITORY",
    "issue_number": 1,
    "issue_url": "https://github.com/OWNER/REPOSITORY/issues/1",
    "title": "Issue title",
    "pull_request_url": "https://github.com/OWNER/REPOSITORY/pull/1",
    "commit_sha": "aaaaaaaaaaaaaaaaaaaaaaaaaaaaaaaaaaaaaaaa"
  },
  "objective": "State the one outcome this handoff requests.",
  "target_model": "gpt-5.6-sol",
  "effort": "Medium",
  "rationale": "This is an independent quality verification task with straightforward evidence.",
  "execution_mode": "durable",
  "sandbox_mode": "workspace-write",
  "is_correction": false,
  "lifecycle_state": "IMPLEMENTATION_READY",
  "lifecycle_event": "IMPLEMENTATION_READY",
  "source_task_key": "issue-1-implementation",
  "target_task_key": "issue-1-qa",
  "recipient_task_keys": ["issue-1-qa", "issue-1-reviewer"],
  "recipient_operation_ids": ["00000000-0000-4000-8000-000000000001", "00000000-0000-4000-8000-000000000002"],
  "readiness_evidence": {"commit_sha": "aaaaaaaaaaaaaaaaaaaaaaaaaaaaaaaaaaaaaaaa", "pull_request_url": "https://github.com/OWNER/REPOSITORY/pull/1", "local_gates": "passed", "ci_status": "passed", "required_checks": [{"name": "validate", "status": "passed"}], "implementation_evidence": {"role": "implementation", "commit_sha": "aaaaaaaaaaaaaaaaaaaaaaaaaaaaaaaaaaaaaaaa", "pull_request_url": "https://github.com/OWNER/REPOSITORY/pull/1", "local_gates": "passed", "ci_status": "passed", "required_checks": [{"name": "validate", "status": "passed"}]}, "qa_evidence": {"role": "qa", "commit_sha": "aaaaaaaaaaaaaaaaaaaaaaaaaaaaaaaaaaaaaaaa", "pull_request_url": "https://github.com/OWNER/REPOSITORY/pull/1", "local_gates": "passed", "ci_status": "passed", "required_checks": [{"name": "validate", "status": "passed"}]}, "review_evidence": {"role": "reviewer", "commit_sha": "aaaaaaaaaaaaaaaaaaaaaaaaaaaaaaaaaaaaaaaa", "pull_request_url": "https://github.com/OWNER/REPOSITORY/pull/1", "local_gates": "passed", "ci_status": "passed", "required_checks": [{"name": "validate", "status": "passed"}]}},
  "watchdog_seconds": 25,
  "inputs": ["Authoritative issue and prior accepted handoffs"],
  "constraints": ["Repository policy and human merge authority"],
  "adrs": ["No relevant ADRs"],
  "acceptance_criteria": ["Observable completion condition"],
  "outputs": ["Expected durable or evidence output"],
  "dependencies": ["None"],
  "escalation": ["Stop when authority or delivery state is ambiguous"],
  "evidence": ["Authoritative URL, commit, check, or reproducible command"],
  "residual_risk": ["Known limitation or None"],
  "terminal_state": "completed"
}
